"topic";"count";"name";"representation";"representative_docs";"carrera"
"3";"6";"3_campaña_análisis_político_fernández";"['campaña', 'análisis', 'político', 'fernández', 'twitter', 'política', 'argentina', 'pandemia', 'comunicación', 'tema']";"['redes sociales y comunicación política : la estrategia de comunicación de la campaña presidencial de alberto fernández en su cuenta oficial de twitter durante las elecciones de   en argentina. el propósito de este trabajo fue el de investigar y describir la estrategia de comunicación política de alberto fernández en su cuenta oficial de twitter durante las elecciones presidenciales de   en argentina. en la actualidad, la comunicación política está profundamente influenciada por el auge de las redes sociales, transformando radicalmente cómo los políticos interactúan con el electorado, la manera en la que se difunden los mensajes y cómo se desarrollan las campañas electorales. el trabajo de campo incluye el análisis de contenido de los tuits seleccionados de la cuenta oficial de alberto fernabdez en twitter durante la campaña oficial presidencial de   en argentina, con el objetivo de establecer el principal eje de campaña del candidato, enunciar los hashtags utilizados en cada mensaje como herramienta de posicionamiento de la misma e identificar los targets prioritarios a los cuales iban dirigidos los mensajes. los resultados indican que la campaña del candidato alberto fernández se destacó por su enfoque estratégico en la crítica al gobierno saliente, la construcción de alianzas políticas sólidas y la promoción de un mensaje de reconstrucción para todos los ciudadanos.', 'análisis del discurso político en twitter de la actual vicepresidenta cristina fernández de kirchner durante la última semana de la campaña de elecciones generales  . el presente trabajo de tesis de licenciatura resulta del análisis del discurso político vinculado con herramientas brindadas a partir de la comunicación digital como las redes sociales y, en especial, twitter. el objetivo general del trabajo fue analizar la construcción del discurso político en twitter de la actual vice presidenta cristina fernández de kirchner, durante la última semana de la campaña electoral general en argentina. entre las técnicas de investigación utilizadas se encuentran el análisis documental y el análisis de contenido. la primera, permitió establecer una base de datos situada en un tiempo y contexto determinado con los enunciados seleccionados, y la segunda, poder generar planillas de contenido, donde se visualizó en detalle cada análisis de las herramientas particulares del análisis del discurso político como tal. la muestra se compuso a partir de los siguientes criterios:   la fecha correspondiente al inicio de la última semana de campaña y   la fecha de cierre de campaña. a partir de ello, se seleccionaron los   twits que fueron usados para el presente análisis. entre los principales enfoques teóricos utilizados para abordar el análisis del discurso y en twitter se encuentran: análisis de deícticos, modalidades, subjetivemas, polifonías y perfil digital.', 'incidencia de la temática pandemia del covid   en la construcción de los mensajes de las campañas políticas, a través de los spots audiovisuales publicitarios, en las elecciones legislativas de la categoría diputados provinciales  , en salta capital. en primer lugar, corresponde una foto esquemática del mapa electoral propuesto. los frentes, los partidos, las organizaciones y sus candidatos. sus nombres y un análisis cuantitativo general de lo que se iba a encontrar la ciudadanía en el cuarto obscuro aquella mañana del   de agosto de  . luego citamos un análisis político contextual. analizar las listas y sus candidatos. sus propuestas o la falta de ellas. en esto vamos a destacar cuales fueron los ejes discursivos de los primeros candidatos de cada lista. tener un panorama más o menos claro de dónde estaba parado ideológicamente cada uno de ellos menuda tarea atento al pragmatismo y hasta la demagogia observada en algunos casos . por supuesto, con especial énfasis en la categoría de diputados provinciales. otro tema a tener muy en cuenta, es la cantidad de spots emitidos por cada lista. tema no menor, dado que pone en relieve el poder de fuego económico de cada sector analizado. existe un claro paralelismo en salta y en el país , entre los triunfos electorales y la cantidad de dinero invertido en las campañas. sin dudas un tema pendiente para nuestra democracia. recordamos aquí que nuestra principal unidad de análisis, es justamente el spot de propaganda política. con relación a esto, vale aclarar que se eligió al mismo, por considerarlo el eje publicitario de toda campaña, en tiempos audiovisuales, donde las redes y la televisión son la tendencia, el spot audiovisual reina y creemos reinará. al menos en el presente y en el futuro cercano. también analizamos a las redes sociales y a la televisión, marco natural de los spots de propaganda política. hacemos un recorrido de este marco en la ciudad de salta, sin descuidar la escala de influencia de cada uno de ellos. teniendo en cuenta también la estratificación social, una de las herramientas fundamentales del marketing político. en este punto llegamos al análisis del contexto temporal en el desarrollo de la campaña. promediando la pandemia, el hartazgo de la gente sobre el tema covid   y sus consecuencias sociales y económicas, sin dudas influyó a la hora de elaborar los mensajes publicitarios. la dinámica de la pandemia, mostraba que la gente buscaba mensajes esperanzadores en sus políticos, y ya no tanto de prevención de contagio. buscaba una salida a las consecuencias sociales del virus. sin dudas esto se notó. de hecho, varios spots, ni siquiera mencionaban el tema de la pandemia que acorraló al mundo y por supuesto también a salta. una suerte de evasión psicológica colectiva. tema de otro análisis más pormenorizado. pero también estuvieron quienes sí hicieron referencia a la pandemia directa o indirectamente. en ellos contrastamos las modernas técnicas de propaganda política y de análisis del discurso, para analizar como lidiaron con la pandemia, sus consecuencias, y las expectativas del electorado salteño. sin dudas, desde el punto de vista comunicacional, una oportunidad única para analizar campañas políticas, en situación de una crisis humanitaria tan particular y poco frecuente. es clave por supuesto finalizar el análisis, a la luz de los resultados electorales. sin ánimo de pecar de resultadistas , dicho análisis es lo que requiere el rigor científico de una ciencia social como la nuestra. observar, destacar, las técnicas empleadas en el mensaje político de los spots en tiempos de pandemia, y contrastarlo con la fría realidad de los resultados del día después. trazar un correlato. sin descuidar las particularidades de una ciudad como salta. nuestro estudio se trata, sobre todo, de la comunicación en tiempos de crisis. particularmente de la comunicación política. en un contexto casi único en tiempos modernos, o posmodernos, y una crisis humanitaria global sin precedentes; una pandemia. nada menos.']";"Licenciatura en Comunicaciones Sociales"
"4";"6";"4_comunicación_nuevas_cuerpo_cambios";"['comunicación', 'nuevas', 'cuerpo', 'cambios', 'formas', 'juegos', 'expresión', 'usuarios', 'aplicaciones juegos', 'avances']";"['propuesta de renovación del plan estratégico de comunicación externa en el ballet de la provincia de salta. en el siglo xxi vemos cómo se producen cambios en la creación y distribución de productos culturales. los cambios sociales unidos al desarrollo tecnológico han afectado al sujeto, y a la creación. por este motivo, aparecen nuevas formas de expresión y comunicación, mientras que las ya existentes ven modificarse su jerarquía y su función, sus paradigmas estéticos y su repercusión social. a través de esta tesis, se pretende investigar la comunicación externa del ballet de la provincia de salta como sector cultural salteño en el cambiante mundo actual, que evoluciona en muchos momentos de manera desordenada, creando nuevos paradigmas culturales y, por ende, comunicacionales. estos paradigmas cambian las formas de relación entre las personas, las formas de intervención cultural, de expresión y de comunicación, demandando así nuevas estrategias de publicidad, difusión y de llegada al público, en este caso, de la danza. existen muchos cambios sociales y tecnológicos que, en estos últimos años, han provocado que la cultura como forma de expresión humana, se vea amenazada enfocándose el presente trabajo particularmente en el ámbito del ballet y reaccione a través de múltiples actores, que defienden su espacio y su importancia social. se plantea un debate que relaciona crisis con cultura, desde la idea más sustancial de la defensa de la expresión humana, hasta el cuestionamiento de un sistema vital y sus consecuencias con estas tecnologías.', 'comunicación y nuevas tecnologías : etnografía de la comunicación en el colegio secundario nº  de rosario de lerma. en el mundo actual se pueden percibir cambios profundos que ocurren a alta velocidad, transformando los hábitos de la humanidad. existen grandes avances en la productividad, transformaciones en las pautas de consumo y, consecuentemente, en las costumbres de los individuos. uno de los principales tópicos de estos cambios es la implicancia de los avances tecnológicos y su impacto en los medios de comunicación. dentro de esta idea es donde se inserta el trabajo de tesis que va estudiar cómo los adolescentes de rosario de lerma desarrollan competencias comunicativas a partir de la interacción con las nuevas tecnologías de la información y de la comunicación ntic . se supone, dentro del marco de esta investigación de grado, que el uso de las ntic produce cambios en la dimensión comunicacional y en el terreno de las comunicaciones. los objetivos propuestos que son estudiados en este contexto comunicacional que se presenta entre los adolescentes a partir del uso de nuevas tecnologías de la comunicación están vinculados en lo metodológico y teórico, utilizando herramientas de la etnografía de la comunicación. los instrumentos metodológicos seleccionados fueron: la observación directa, la entrevista etnográfica no estructurada y la encuesta. la observación directa se utilizó con el propósito de conocer el ámbito donde se desenvuelven los estudiantes. la entrevista etnográfica no estructurada se empleó para profundizar el trabajo de campo. la encuesta se focalizó sobre todo en el grado de usos de las ntic y un breve bosquejo de la situación social para enriquecer la investigación. el método elegido fue el cualitativo, acorde con la etnografía de la comunicación. cabe destacar que se desarrollaron aspectos teóricos conceptuales tales como el desarrollo del modelo speaking propuesto por dell hymes, etnografía de la comunicación y aspectos que se deben considerar del marco social particular de cada grupo de análisis desde la mirada de autores como cabero   y mcluhan   que conformaron la base epistemológica de la presente investigación.', 'la comunicación y la danza contemporánea. sea por el momento histórico, la contemporaneidad a flor de piel, y por las nuevas tecnologías de la información y la comunicación, junto a las formas de ser que de allí se desprenden, los modos de vincularnos y comunicarnos se ubican actualmente en un espacio de transición entre tradicionales y novedosas perspectivas. soy más de lo que ves y lo que digo que soy? una rutina mecanizada y memorizada que alberga otra dimensión, en la que los individuos son más que las líneas de un código de barra unánime. precisamente, los interrogantes empapan un nuevo escenario. no es paradójico que el   de nuestra comunicación se deba a un lenguaje no verbal, al idioma del cuerpo, antes que a las verborragias postmodernas? en este devenir de reflexiones, la comunicación y la cultura emergen como ejes de un proceso social que involucra a todos. la investigación en cuestión propone a la comunicación como un proceso transformador socio cultural, haciendo foco en la danza contemporánea por sus implicancias con la corporalidad. el abordaje se basa en el enfoque del interaccionismo simbólico, ya que profundiza en el diálogo, el intercambio y la creatividad conjunta, entendiendo a la interacción como una forma de reescribir el espacio y el tiempo bajo la lógica discursiva de un cuerpo presente. el cuerpo configurado como un todo, bajo una concepción holística, plural, participativa y coordinada para convertir a las ideas prestablecidas en un universo de posibilidades, donde las diferencias nos acercan y las similitudes nos consolidan. un cuerpo que toma ventaja hasta imponerse como canal de expresión, comunicación y aprendizaje considerando sustancialmente a cada sujeto involucrado, activo y creador, en el circuito artístico, social y cultural. parafraseando a marshall mcluhan, el cuerpo es el mensaje. hay más información en nuestro cuerpo de lo que creemos o pensamos. si aceptamos esto, estaremos en condiciones de entender que, si se trata de una obra de arte o alguna práctica artística en particular, la experiencia implica una demanda de sensibilidad y propiocepción mayor para involucrarnos de lleno en el proceso, del cual no podemos salir intactos. es decir, la actividad creativa conlleva un flujo que nos remite al cambio como la única constante. la transformación paulatina es casi imperceptible pero acertada, siendo inevitable salir distintos de un espacio y tiempo que elegimos vivir; ponerle el cuerpo al momento, en un mundo en donde ser accesible es la condición necesaria para aprender y aprehender lo que se nos es dado, lo que el otro quiere decir, o todavía más, lo que yo tengo para decir.']";"Licenciatura en Comunicaciones Sociales"
"-1";"12";"-1_desempeño_evaluación_comunicación_evaluación desempeño";"['desempeño', 'evaluación', 'comunicación', 'evaluación desempeño', 'proceso', 'comunicación interna', 'interna', 'organización', 'empleados', 'employer branding']";"['la evaluación de desempeño en cafe martínez y su incidencia en el nivel de desempeño de los trabajadores, en la ciudad de salta durante el año  . en el presente trabajo se indaga la importancia del uso de la evaluación de desempeño y su relevante repercusión en el nivel de desempeño de los recursos humanos de la organización, que permitirá mejorar la productividad, eficiencia y compromiso de los empleados de dicha empresa. la evaluación de desempeño presenta una profunda conexión con el desempeño laboral, es decir que el coopera a realizar este tipo de evaluación promoverá a los empleados a mejorar su eficiencia, productividad y comportamiento tanto en su puesto de trabajo como de manera general en la organización. también, a través de la misma, la empresa puede reconocer si existen fallas en el análisis y descripción de cargos, ya que los empleados están obligados a conocer cuáles son sus funciones y competencias para realizar su trabajo y desempeñar su puesto con mayor eficiencia. esto se ve ligado a la evaluación de desempeño, puesto que si existiera deficiencia en el análisis y descripción de los cargos los trabajadores no sabrían desempeñarse adecuadamente y por lo tanto fallarían al momento de ser evaluados, produciendo una contribución negativa para alcanzar los objetivos de la organización...', 'comunicación interna en una empresa jujeña de viajes y turismo para egresados con destino a san carlos de bariloche en el año  . en el presente trabajo final de grado se investigó la comunicación interna en una empresa jujeña de viajes y turismo. el objetivo general propuesto fue describir el proceso de comunicación interna aplicado por la empresa flecha bus viajes para los servicios a egresados del nivel secundario de escuelas de san salvador de jujuy, con destino a san carlos de bariloche en el año  . para ello se trabajó desde el paradigma interpretativo, con un enfoque cualitativo, se realizó un trabajo de campo etnográfico, utilizando como técnicas de recolección de datos la observación participante y no participante, se realizaron entrevistas a los vendedores, coordinadores y juniors, como así también al encargado. finalmente se sistematizó y analizó toda la información que se verá plasmada en cada uno de los capítulos. se concluye que sin un marco de comunicación formal que facilite el ida y vuelta de la información, es de este modo como flecha bus viajes ha forjado su modelo de comunicación en base a mensajes o audios a través de las redes sociales que manejan. cabe señalar que esto pasa no por desidia sino porque en su matriz de funcionamiento institucional no existe ningún acuerdo de segundo orden que sostenga la comunicación interna como un eje prioritario para la acción. se recomienda formalizar un marco de comunicación planificado y sistemático, al no existir herramientas de medición en materia de comunicación interna institucionalizadas, la organización no puede certificar la efectividad de sus canales, será necesario generar herramientas adecuadas de medición para la realización de un posterior plan de comunicación.', 'evaluación de desempeño. la evaluación de desempeño constituye el proceso por el cual se estima el rendimiento global del empleado. la mayor parte, de los empleados, procura obtener retroalimentación sobre la manera en que cumple sus actividades y las personas que tienen a su cargo la dirección de otros empleados deben evaluar el desempeño individual para decidir las acciones que deben tomar. las evaluaciones informales, basadas en el trabajo diario, son necesarias pero insuficientes. contando con un sistema formal y sistemático de retroalimentación, el departamento de personal puede identificar a los empleados que cumplen o exceden lo esperado y a los que no lo hacen. así mismo, ayuda a evaluar los procedimientos de reclutamiento, selección y orientación, incluso las decisiones sobre las promociones internas, compensaciones, estas dependen de la información sistemática y bien documentada disponible sobre el empleado. además de mejorar el desempeño, muchas empresas utilizan esta información para determinar las compensaciones que otorgan. un buen sistema de evaluación puede, también, identificar problemas en el sistema de información sobre recursos humanos. las personas que se desempeñan de manera insuficiente pueden poner en evidencia procesos equivocados de selección, orientación y capacitación, o puede indicar que el diseño del puesto o los desafíos externos no han sido considerados en todas sus facetas. una organización no puede adoptar cualquier sistema de evaluación del desempeño, este debe ser válido y confiable, efectivo y aceptado. el enfoque debe identificar los elementos relacionados con el desempeño para los empleados medirlos y proporcionar retroalimentación a los empleados y al departamento de personal o a la dirección de la empresa...']";"Licenciatura en Recursos Humanos"
"0";"49";"0_recursos_recursos humanos_humanos_empresa";"['recursos', 'recursos humanos', 'humanos', 'empresa', 'trabajo', 'proceso', 'gestión', 'investigación', 'área', 'personal']";"['gestión estrategica de recursos humanos, desarrollo e implementación de los procesos correspondientes a los subsistemas de integración y organización en la empresa colorearg durante el año  . los subtemas de desarrollo y organización de chiavenato se basan en el correcto proceso de reclutamiento y selección de personal los cuales están acompañados de un análisis y descripción de puestos. estas herramientas son fundamentales para poder incorporar capital humano valioso para la organización. el reclutamiento es el proceso que realiza la empresa para poder identificar y atraer a los candidatos para cubrir el puesto bacante, dichos candidatos pueden provenir del ambiente interno como externo. el siguiente paso para la adquisición de personal es la selección, proceso en el cual se evalúan las cualidades, conocimientos, habilidades y la experiencia del candidato. el objetivo de dicho proceso es elegir al candidato que cumpla de manera adecuada con las exigencias del puesto. tanto el reclutamiento como la selección tienen su base de acción en el análisis y descripción de puestos, en él se especifican que tipo de conocimientos, habilidades, competencias, exigencias, funciones y responsabilidades van a exigir el puesto a la persona, para el correcto desempeño de la misma en la organización. tomando en cuenta lo anterior y recalcando la importancia de estos procesos en el correcto funcionamiento de las tareas, el presente trabajo pretende aplicar de forma adecuada los subsistemas de integración y organización en la empresa colorearg y así contribuir a mejorar el desempeño de los trabajadores...', 'proceso de reclutamiento y selección de asesores comerciales en una empresa privada de comercialización de vehículos de la provincia de jujuy. cualquier organización, independientemente de su tamaño, debe procurar contar con el personal adecuado y calificado en cada uno de sus puestos de trabajo, para garantizar su funcionamiento. esto se logra gracias a la administración de recursos humanos, mediante su función de reclutamiento y selección de personal. el tema de la presente investigación es sobre el proceso de reclutamiento y selección de asesores comerciales en una empresa privada de comercialización de vehículos de la provincia de jujuy durante los años   y  . la empresa seleccionada para el estudio es autosol s.r.l. es una empresa que se dedica al rubro de ventas y comercialización de autos   km y usados certificado por normas de calidad iso  ; cuenta con una casa central dedica a la venta directa y una sucursal para comercialización de planes de ahorros. la función de reclutamiento y selección, está destinada a proveer de manera oportuna y a un costo adecuado de personal calificado a la organización. atendiendo a estos planteamientos la presente investigación tuvo como objetivo principal, describir el proceso de reclutamiento y selección de asesores comerciales implementado por la empresa autosol s.r.l de san salvador de jujuy en el periodo  . se pensó en los asesores comerciales porque gran parte de los ingresos de esta empresa dependen de la capacidad para vender los productos y servicios de la misma; es por ello que los asesores comerciales deben disponer de cierto talento humano calificado en sus tareas, y así satisfacer las necesidades de sus clientes y alcanzar los objetivos de la organización. el problema es que el reclutamiento y selección de personal no es tarea fácil, no es una ciencia exacta, siempre cabe la posibilidad de un error. cuando esto sucede, el resultado es la incorporación a la empresa de personas que pueden no ser funcionales. describir este proceso permitirá conocer cómo actúa la empresa autosol s.r.l. para atraer y seleccionar candidatos para el cargo de asesores comerciales...', 'proceso de reclutamiento y selección del personal de una empresa comercial, rubro ferretería industrial : empresa dergam srl de la ciudad de san salvador de jujuy entre los años   y  . en el presente trabajo se refleja lo aprendido de la investigación realizada junto a los integrantes de dergam s.r.l. cabe resaltar que no se podría haber llevado a cabo sin la buena predisposición de los dueños de la empresa y sus empleados, quienes brindaron su valioso tiempo para realizar las entrevistas y observaciones. esto dio lugar a un proceso complejo y dinámico; las visitas posibilitaron el reconocimiento de cada puesto de trabajo y su relación con los procesos de reclutamiento y selección. se exponen el argumento y las conclusiones que siguen a continuación sobre la base de la trama empírico analítica construida a través del trabajo de campo. en el desarrollo del documento se podrán apreciar el análisis respecto a la cuestión metodológica y al trabajo de campo. se intentó durante todo el proceso mantener una fuerte vigilancia epistemológica para no desviarse durante el análisis. el objetivo principal del presente estudio es comprender el proceso de reclutamiento y selección del personal implementado por la empresa dergam s.r.l de san salvador de jujuy en el periodo   como podrá observarse en el desarrollo del trabajo se entiende que la descripción clara de los puestos no puede estar disociada del proceso de reclutamiento y selección. por lo tanto el procedimiento fue el siguiente, una vez identificada la necesidad de contar con esa información, se intentó proponer un sencillo manual con cada puesto de trabajo a fin de colaborar en la gestión de los recursos humanos de la empresa. constituye una propuesta sustentada en el conocimiento teórico y la sistematización de la práctica en la institución. se espera con esta investigación colaborar con la empresa para dar coherencia y sustento a los procesos de reclutamiento y selección, a su vez se pretende brindar un aporte a los futuros colegas. más allá de que la presente tesis constituye un trabajo individual, el mismo no es un resultado producido por una persona, se entiende que participaron muchos sujetos, desde sus narraciones y, pensándose a sí mismos a partir de las entrevistas realizadas y de la guía del director tesis...']";"Licenciatura en Recursos Humanos"
