"topic";"count";"name";"representation";"representative_docs";"carrera"
"1";"17";"1_laboral_clima_rotación_personal";"['laboral', 'clima', 'rotación', 'personal', 'trabajo', 'investigación', 'organizacional', 'clima laboral', 'clima organizacional', 'estrés']";"['la incidencia de la satisfacción laboral en los niveles de rotación y ausentismo del municipio de general güemes durante el año  . en el presente trabajo de investigación se analizan las variables que determinan el ausentismo y la rotación laboral relacionados con los factores que influyen en la satisfacción de los empleados, para luego diseñar planes de acción que contribuyan a revertir la situación actual. hoy en día muchas empresas centran las acciones para disminuir sus niveles de rotación y ausentismo en la dirección de recursos humanos, pero es de suma importancia que las estrategias para reducirlos estén alineadas a las políticas de la dirección general de las organizaciones. las empresas deben tener en cuenta que el poseer un alto nivel de rotación y ausentismo, tiene influencia en los términos económicos de la misma y es por ello que las acciones dirigidas a reducirlos se deben apreciar como una inversión para que sean eficaces y deben ser asociadas con la productividad de la empresa. a lo largo de la investigación se descubre el origen del ausentismo y la rotación laboral, sus determinantes y la relación directa que posee con el grado de satisfacción laboral de los empleados. así también proporciona importante información acerca del impacto negativo que ejerce la insatisfacción laboral en la empresa y que se manifiesta en un alto índice de rotación y ausentismo.', 'diagnostico del clima organizacional en un sanatorio de la provincia de jujuy   . el tema de estudio del presente trabajo es el diagnóstico del clima organizacional en un sanatorio de la provincia de jujuy   . el origen de esta investigación surge por una experiencia personal cuando asistí a sacar turno y presencié una situación tensa entre camilleros, al realizar el primer acercamiento con la responsable de recursos humanos, la misma comenta que los conflictos laborales y o personales se presentaban cotidianamente lo que generaba un clima poco favorecedor. contemplando dichas situaciones, surge el interés por describir el clima organizacional del sanatorio, donde sería conveniente identificar la satisfacción laboral de las personas que trabajan en la organización y su incidencia en el clima organizacional de la empresa a partir de establecer asociaciones entre tres dimensiones de análisis: personal, social y organizacional. se espera que los resultados emergentes aporten utilidad, particularmente a quiénes son los responsables de tomar decisiones, la información recabada permitió establecer un diagnóstico general del sanatorio, describiendo e indicando a qué dimensiones será necesario prestarle atención para mejorar el clima laboral y las condiciones. en lo que respecta a lo metodológico el presente tfg se corresponde con una investigación descriptiva cuyo objetivo es el análisis de los fenómenos y el estudio de sus relaciones, se utilizó el método deductivo y el enfoque del estudio fue cuantitativo. en lo que respecta a la técnica de recolección de datos se realizaron encuestas fuentes primarias que fueron realizadas de manera personal...', 'el clima laboral y su relación con el nivel de rotación de personal externa en el área comercial de la empresa edesa s.a. el presente trabajo de investigación consiste en un estudio de tipo descriptivo no experimental, llevado a cabo durante el segundo semestre del año  , en el que se buscó establecer la relación entre el clima laboral y el nivel de rotación de personal externa del área comercial de la empresa edesa s.a. dicha investigación surge debido a la importancia que, en la actualidad, el clima laboral y la rotación de personal generan en quienes forman parte de las organizaciones y que impactan en aspectos tales como la motivación, productividad, ausentismo, satisfacción laboral, entre otros. para profundizar dicha investigación se tuvieron en cuenta distintas fuentes teóricas, desde bibliografía de autores especialistas en los temas tratados, como también, páginas web y diferentes investigaciones realizadas. para ello, se realizó un estudio de campo utilizando diversas técnicas de recolección de datos, de entre las cuales fueron una encuesta de clima laboral y el cálculo del índice de rotación de personal. se logró trabajar con un total de   trabajadores de dicha área, por lo que se considera una muestra representativa. se concluye en que la hipótesis planteada se confirma, por lo que se espera que esto pueda servirle a la empresa implicada, dejando recomendaciones que puedan ayudar a mejorar las variables tratadas y es por lo planteado que se presenta este trabajo de investigación...']";"Licenciatura en Recursos Humanos"
"2";"15";"2_laboral_empresas_empresa_personas";"['laboral', 'empresas', 'empresa', 'personas', 'satisfacción', 'habilidades', 'motivación', 'organizacional', 'empleados', 'desempeño']";"['influencia de la satisfacción laboral en la productividad de la empresa nutrirec biofarma ,  . en los últimos años, la gestión de recursos humanos y la administración organizacional fue adaptándose a las nuevas tendencias y necesidades de los actores involucrados, aplicando teorías y herramientas que traten temas cómo la satisfacción laboral, la motivación de los trabajadores y la importancia del clima organizacional. es decir, recibir un salario alto no es el único factor que garantiza que los trabajadores realicen sus funciones cómo son esperadas por la empresa, sino que deben atenderse también otros aspectos de la gestión del personal. en este contexto, esta tesis se centra en un aspecto fundamental de la gestión de recursos humanos, la satisfacción laboral y su influencia en la productividad de la empresa nutrirec biofarma durante el año  . con el objetivo de contribuir a la mejora continua de la organización y generar conocimientos significativos sobre la gestión de recursos humanos en el sector industrial alimenticia. a medida que avanzamos en esta investigación, analizaremos la relación entre la satisfacción laboral y la productividad, y describiremos, identificaremos y evaluaremos su impacto en el desempeño de la empresa en el primer semestre de  ...', 'incentivos no monetarios, motivación y desempeño laboral. el modo de incentivar al personal es uno de los aspectos centrales de la cultura de una empresa. en este contexto, la motivación es un factor clave en la gestión de talento humano, lo que lleva a que el departamento de recursos humanos sea una unidad operativa que funciona como órgano capaz de prestar servicios muy diversos, como por ejemplo el reclutamiento, la selección, el entrenamiento, la remuneración y por supuesto, las motivaciones e incentivos. la bibliografía relacionada a la gestión de los recursos humanos destaca que las personas pasan gran parte de sus vidas trabajando en empresas, las que dependen de las personas para operar, tanto como los individuos dependen de su trabajo para subsistir. por esta razón, separar el trabajo de la vida de las personas es casi imposible, ya que ambas partes mantienen una relación de dependencia mutua para obtener beneficios recíprocos. para que esta relación sea reciproca en términos justos, es fundamental el papel de la gestión de los rr.hh., la que debe contribuir a la eficacia organizacional a través de ayudar a la empresa a alcanzar sus objetivos, proporcionándole competitividad y logrando que los esfuerzos de las personas sean mas productivos para beneficiar a los cliente, socios y mismos empleados. en este marco, una buena gestión de los recursos humanos debe suministrar empleados motivados, considerando que no solo el dinero constituye el fundamento de la motivación humana. hoy esta aceptado que para mejorar el desempeño, existen otros factores, pues si bien los empleados satisfechos no siempre son los mas productivos, los insatisfechos tienden a desligarse de la empresa, se ausentan con frecuencia, no logran de manera eficiente y eficaz los objetivos o incluso no los alcanzan...', 'soft skills y desempeño laboral de los trabajadores del área de rrhh de la empresa natur s.a.. las soft skills, habilidades blandas en español, son determinantes para que las personas puedan desempeñarse de manera adecuada en el ámbito laboral. doyle   refiere a las soft skills como las características no técnicas que desarrolla una persona en la empresa. esto incluye cómo interactúa con sus compañeros de trabajo, que capacidad tiene para resolver problemas o cómo administra su trabajo. doyle   expone que las soft skills se complementan con las hard skills, habilidades que refieren a las competencias que se adquieren mediante formación y experiencia profesional. por ejemplo, en el área de recursos humanos se podrían resaltar las habilidades de llevar a cabo análisis de puestos y de perfiles, administrar los sistemas de compensación y liquidación de haberes, entre otras. por otro lado, gutierrez sernaque   expresa que en la actualidad, el tema de habilidades blandas ha tomado mayor relevancia al momento de evaluar el desempeño de los colaboradores, pues muchas veces el éxito o fracaso dependerá del desarrollo de estas p.  . de acuerdo con de la riva araluce   las habilidades personales blandas no sólo favorecen el buen ambiente de trabajo para la consecución de los objetivos propuestos, sino que también, soft skills como la iniciativa o la creatividad, ofrecen a la compañía la posibilidad de beneficiarse de una clara ventaja competitiva frente al resto de empresas del sector p.  . según delgado esquerre y sierra gonzales   , en los últimos años a nivel internacional en el ámbito laboral se habla mucho sobre las habilidades sociales o desarrollo de las habilidades blandas para mejorar el desempeño en el espacio laboral debido a que las personas transcurren gran parte del día en sus trabajos enfrentándose a múltiples problemas. los departamentos de recursos humanos de las organizaciones prioritariamente focalizan, desde la etapa de reclutamiento, la búsqueda y desarrollo de las relaciones interpersonales, actitud positiva, resiliencia, liderazgo, etc. p.  ...']";"Licenciatura en Recursos Humanos"
"3";"9";"3_liderazgo_diferencias_personas_trabajo";"['liderazgo', 'diferencias', 'personas', 'trabajo', 'gestión', 'empresa', 'diversidad', 'colaboradores', 'año', 'motivación']";"['el liderazgo como herramienta para la integración estratégica de la diversidad generacional en empresas familiares : caso de estudio: león vidrios de salta capital en el año   . actualmente en el mundo del trabajo, vivimos un fenómeno que ha despertado gran interés: el   de los profesionales se relaciona con al menos   generaciones distintas en su lugar de trabajo. esta diversidad generacional no es un factor menor dentro de una empresa, ya que cada generación está compuesta por individuos que crecieron y se desarrollaron en un entorno significativamente distinto al de aquellos perteneciente a la generación anterior. por lo tanto, tienen diferentes intereses, valores, expectativas, prioridades; entienden el trabajo, la autoridad, las relaciones profesionales de formas distintas; y ejercen la responsabilidad también a su manera. la convivencia de estas generaciones implica un gran desafío para todos, pero especialmente para aquellos que se encargan de la dirección de personas. conocer estas diferencias les aportará elementos para identificar puntos de encuentro, complementarse y lograr sinergias, para detectar las posibles fuentes de conflictos, evitarlos a tiempo o manejarlos adecuadamente. por ello, mediante el presente trabajo, analizamos cómo los líderes pueden colaborar en la integración de esta diversidad generacional, a través de la comprensión de las características de cada grupo, el reconocimiento de sus fortalezas, coincidencias, complementariedades; con el objetivo de convertir la diversidad en una fuente de riquezas de ideas y soluciones, maximizando los beneficios...', 'barreras en la comunicación interna presentes en la generación millennial en los trabajadores pertenecientes a un grupo empresario de la provincia de córdoba capital en el mes de noviembre del  . el grupo empresario, milán sa, se inicia en los años   como sólo una empresa familiar dedicada a la venta de maquinaria agrícola de diversas marcas, como así también a la venta de semillas. en  , un mundialmente reconocido fabricante de maquinaria agrícola le otorga la concesión para la ciudad de córdoba y jesús maría. la firma conserva el predio e implementa mejoras edilicias para brindar a sus clientes el mejor servicio de comercialización, repuestos y servicio post venta. a lo largo de los años, con la apertura de la frontera agrícola en el norte de la provincia, el incremento de la demanda de equipamientos e insumos y el crecimiento sostenido capitalizado por la firma, se permitió proyectar el área de influencia hacia nuevas zonas, concretándose en las designaciones hacia fines del   de la sucursal de pilar y en el   de la sucursal jesús maría, concluyendo en el   con la inauguración de la sucursal santa rosa de rio   , reafirmando así el crecimiento de la frontera norte. a fines del  , se observó un panorama oportuno para encaminar con mayor claridad las metas, los negocios y encarar con mejor perspectiva el proceso de mejora continua que caracterizó siempre a la firma. de esta manera, nace una nueva empresa: milán sa, que agrupa las áreas de maquinaria, repuestos y servicio post venta. en el año  , el socio fundador jc adquiere lm, una sociedad agropecuaria ya constituida dedicada a la cría y engorde de ganado vacuno, como así también al cultivo de cereales como soja, maíz y trigo...', 'tipos de liderazgo en las diferentes generaciones del personal de una empresa que presta servicios públicos en la ciudad de salta durante el segundo periodo del año  . una de las grandes problemáticas de las empresa del siglo xxi es aprender a gestionar la diversidad que existe entre los miembros que la componen. no solamente se refiere a garantizar ambientes de trabajos libres de discriminación, sino, además, de saber valorar las diferencias como una oportunidad para poder comprender mejor un nuevo mundo moderno. si bien existen características que hacen únicos a los baby boomers , generación x o y es importante aclarar que no hay una mejor o peor que otra, sino que solo se encuentran diferencias entre las mismas, donde es posible encontrar puntos de encuentro para maximizar los aportes de cada parte, ya sea la rapidez de uno o la experiencia del otro. las diferencias generacionales que se les atribuye a los miembros de una organización brindan la posibilidad de que las mismas sean capaces de aprender a partir de las diferencias atribuidas y así lograr ser más innovadores, productivos y flexibles. cabe aclarar que con diferencias generacionales me refiero a por ejemplo, las formas de ver el liderazgo, de desempeñar sus tareas, su visión de trabajo, su relación con la autoridad, la visión de seguridad laboral, de desarrollo etc. es importante que todo comprenda que las diferencias potencializan el desarrollo del negocio y que es sumamente importante integrar las visiones y esfuerzos para lograrlo. una rol imprescindible es el que se le va a otorgar al líder de un equipo. ellos tendrán que desarrollar habilidades para satisfacer expectativas muy diferentes. cada vez más, los equipos de trabajo estarán conformados por gente con distintas mentalidades que deberán trabajar juntas en pos de un objetivo común,   y esto requiere enormes cambios en nuestros modelos mentales...']";"Licenciatura en Recursos Humanos"
"4";"8";"4_teletrabajo_trabajo_social_medidas";"['teletrabajo', 'trabajo', 'social', 'medidas', 'covid', 'virus', 'conciliación', 'empresas', 'pandemia', 'situación']";"['ambiente y desempeño laboral en una pyme de fabricación y venta de cinturones artesanales durante la cuarentena por covid   del año   en la ciudad de salta. actualmente el mundo se encuentra atravesando una pandemia mundial por el virus denominado covid  . las empresas enfrentan múltiples desafíos, entre ellos la gran cantidad de trabajadores que cursan una cuarentena regulada por las autoridades locales a fin de disminuir la tasa de contagios. es de suma importancia tomar recaudos correspondientes a fin de cumplir los decretos emitidos en el boletín oficial de la nación argentina y adaptarse a las nuevas modalidades de trabajo emergentes. la adopción de teletrabajo o trabajo denominado remoto en las relaciones laborales es uno de los nuevos paradigmas que fueron adoptando muchas empresas en el contexto de aislamiento social preventivo y obligatorio por la gran concentración de colaboradores en los lugares de trabajo. en consecuencia la gestión de los recursos humanos se ve afectada en su totalidad. para mantener las relaciones laborales en los contextos económicos y sociales presentes cada empleador debe procurar un buen desempeño organizacional sin dejar de lado el ambiente laboral que genera el transitar esta situación epidemiológica...', 'el impacto de las medidas sanitarias gubernamentales sobre el sars covid   en los procesos de capacitación y rotación del personal de una pyme de la ciudad de salta durante el periodo   y  . durante el año  , surgió un virus denominado sars covid  , declarado en wuhan república popular china , el cual se desencadeno a nivel mundial. tuvo un fuerte impacto en el año   para la sociedad y las organizaciones, sobre todo en empresas pymes, generando un desafío para las mismas, estableciendo al departamento de recursos humanos como elemento primordial para la organización. el departamento de recursos humanos debe ser capaz de poder afrontar la situación focalizando la salud y bienestar de los empleados sin olvidarse de la viabilidad del proyecto empresarial. determinando los factores tantos internos como externos que generan un impacto en la organización, evaluarlos y tomar decisiones teniendo como base primordial el objetivo general de la empresa, estableciendo la cantidad y calidad del personal, para llevarlo a cabo es importante realizar una capacitación constante para afrontar la situación actual. dado que la crisis de sars covid   perturba a las organizaciones de todo el mundo, los líderes de rr.hh, deben responder de forma rápida y exhaustiva, teniendo en cuenta las consecuencias inmediatas y a largo plazo para el talento . brian kropp en el presente trabajo relacionare las temáticas abordadas anteriormente, mediante la recopilación de datos de la empresa familiar de venta mayorista y minorista de fiambres, lácteos y productos en general, de la provincia de salta, respetando las políticas y confiabilidad de la misma...', 'la incidencia del teletrabajo en la conciliación trabajo familia de los colaboradores del sector estadística del hospital oñativia durante el año  . desde los recursos humanos se habla del teletrabajo hace más de una década, cuando se referían a modificar las estructuras organizacionales, haciéndolas más planas, flexibles, horizontales y modulares; se habló también de ciertos cargos que en el futuro no requerirían estar dentro de una empresa, oficina o contexto similar, también visualizo en las empresas modernas, nuevas prácticas laborales como: el salario emocional, responsabilidad social corporativa orientado a la gente, cómo conciliar el trabajo y la vida familiar, etc. estos procesos de la gestión de los recursos humanos lleva a buscar un equilibrio y funcionalidad entre el trabajo y las expectativas de los nuevos trabajadores del siglo xxi combinando sus espacios de vida, deporte, desarrollo académico y tiempo. cuando se refiere a la pandemia es necesario entender que se está transitando una a normalidad: el teletrabajo. en muchos casos el aislamiento social preventivo y obligatorio aspo impuso el home office como única alternativa de continuidad laboral, y en ese marco hubo que resignar muchos elementos del trabajo presencial que eran importantes y que quizás no estén presentes mientras dure la pandemia. los conceptos de teletrabajo , trabajo remoto , suspensión del trabajo , vacaciones forzadas , cuidar a los niños y niñas aparecieron de golpe y mezclados entre sí...']";"Licenciatura en Recursos Humanos"
"-1";"39";"-1_salta_investigación_comunidad_año";"['salta', 'investigación', 'comunidad', 'año', 'estudio', 'ciudad salta', 'ciudad', 'conocer', 'presente', 'salud']";"['la representación social de una comunidad rural sobre el rol del psicólogo en la localidad de cachi, salta. en la presente investigación se conocieron los motivos que influyen en la elección de los distintos marcos referenciales teóricos clínicos de los estudiantes avanzados de la carrera licenciatura en psicología de la ucasal cuya predilección en el año   es la psicología clínica como futura área de aplicación profesional. también fue posible identificar cuáles son las líneas teóricas más y menos elegidas por los participantes. el presente trabajo investigativo, encuentra su fundamentación en el marco de la psicología educacional, puesto que su objeto de estudio es la conducta que se produce por parte de los educandos, en un contexto educativo de nivel universitario. se trata de un estudio cuantitativo, no experimental, descriptivo y de corte transversal. se utilizó como instrumento de recolección de datos un cuestionario auto administrado. la muestra estuvo compuesta por   estudiantes de   año de la carrera. los resultados de la investigación respaldaron la hipótesis de que la formación académica recibida sería el motivo más influyente a la hora de elegir entre las distintas líneas teóricas con un   . el psicoanálisis fue la línea teórica más elegida en un   , seguida del modelo integrativo ecléctico en un   , mientras que la menos elegida fue el conductismo contextual con un   de los casos.', 'representación social de la vejez de los adultos mayores y su relación con la elección de las actividades que ofrece el movimiento de jubilados y pensionados salta . la presente investigación se enfocó en conocer la representación social de la vejez que tienen los adultos mayores que asisten al movimiento de jubilados y pensionados salta , con la motivación de poner en tensión las imágenes, creencias, estereotipos y prejuicios que tiene la sociedad sobre esta población. además, se indagó sobre cómo esta representación puede relacionarse con la elección de una actividad en dicho contexto, para poner en evidencia las limitaciones y posibilidades de esta representación. para llevar a cabo esta investigación se trabajó con la teoría de las representaciones sociales, desarrollada por moscovici   y jodelet   , reconociendo sus tres dimensiones: idea o información, campo de representación y actitud o valoración. es una investigación cualitativa cuyos instrumentos fueron la observación y la entrevista en profundidad. la muestra estuvo conformada por los adultos mayores que realizan actividades en dicha institución. en el análisis de los datos surgieron diversas representaciones con el predominio de dos definiciones de vejez como una etapa más y como destino biológico ; y en relación a su inicio es definida en términos de tener o no tener ganas de vivir y hacer o no hacer cosas . se concluye que todas estas representaciones están atravesadas por el contexto y la posición que tiene el adulto en él.', 'el proyecto de vida de los jóvenes en contexto de encierro que se encuentran privados de su libertad en el centro de atención a jóvenes en conflicto con la ley penal nº  , salta capital. la presente investigación se enfocó en conocer la representación social de la vejez que tienen los adultos mayores que asisten al movimiento de jubilados y pensionados salta , con la motivación de poner en tensión las imágenes, creencias, estereotipos y prejuicios que tiene la sociedad sobre esta población. además, se indagó sobre cómo esta representación puede relacionarse con la elección de una actividad en dicho contexto, para poner en evidencia las limitaciones y posibilidades de esta representación. para llevar a cabo esta investigación se trabajó con la teoría de las representaciones sociales, desarrollada por moscovici   y jodelet   , reconociendo sus tres dimensiones: idea o información, campo de representación y actitud o valoración. es una investigación cualitativa cuyos instrumentos fueron la observación y la entrevista en profundidad. la muestra estuvo conformada por los adultos mayores que realizan actividades en dicha institución. en el análisis de los datos surgieron diversas representaciones con el predominio de dos definiciones de vejez como una etapa más y como destino biológico ; y en relación a su inicio es definida en términos de tener o no tener ganas de vivir y hacer o no hacer cosas . se concluye que todas estas representaciones están atravesadas por el contexto y la posición que tiene el adulto en él.']";"Licenciatura en Psicología"
