"topic";"count";"name";"representation";"representative_docs";"carrera"
"-1";"11";"-1_empresa_comunicación_mujer_cliente";"['empresa', 'comunicación', 'mujer', 'cliente', 'salta', 'investigación', 'estrategias', 'pyme', 'clientes', 'género']";"['análisis de la percepción de los jugadores pertenecientes a dos equipos y una comunidad esport de la ciudad de salta; sobre las mujeres dentro de los videojuegos a partir de los skins femeninos de fortnite. a lo largo de la historia de los videojuegos, los personajes femeninos muchas veces fueron sexualizados, generando que los jugadores adopten percepciones similares a las que transmite esta forma de entretenimiento. esta investigación busca conocer la percepción que tienen los jugadores salteños participantes de dos equipos de esport: oniria gaming y central norte esport; y la comunidad gamer de la ucasal sobre los personajes femeninos de uno de los videojuegos más populares entre los jóvenes actualmente: fortnite. para llevar adelante este análisis, se tiene en cuenta principalmente los conceptos e ideas sobre el género femenino dentro de los videojuegos planteados por nira santana rodríguez en su estudio género, gamers y videojuegos de  , y las acotaciones de carmen micó luengo en su investigación la transmisión de roles de género y estereotipos de la mujer a través de los videojuegos de  . además, se intentará demostrar, a través de encuestas a gamers, que actualmente fortnite no atrae a los jugadores con aspectos sexualizados en sus skins femeninos, sino, por las estrategias que cada jugador puede tener a la hora de elegirlos.', 'comunicación estratégica e interactividad : estrategias de comunicación digital para lograr la interactividad de una pyme con sus clientes que le permita la notoriedad en redes sociales. esta investigación analiza las estrategias de comunicación digital para lograr la interactividad de una pequeña y mediana empresa pyme con sus clientes que le permita la notoriedad, teniendo como estudio de caso a la pyme altoandina soluciones modulares, situada en vaqueros, provincia de salta en el año  . es así, que en este trabajo se identifica la interactividad de la pyme en su página web mediante complementos o plug in que muestren la preferencia de búsqueda de información de los usuarios al entrar al sitio mediante un registro de observación que se realizó en la página web de la empresa. además, se conocieron las preferencias de los usuarios para contactarse con el área de ventas, teniendo en cuenta las vías de comunicación de la pyme: teléfono, e mail, redes sociales y la propia página web a través de encuestas dirigidas a los clientes. asimismo, se pudo conocer la opinión postventa del cliente sobre el asesoramiento y la experiencia con el vendedor y la calidad del producto para evaluar la forma en que la pyme debe fidelizar a los clientes estableciendo un análisis foda donde se exponen las estrategias para alcanzar esa fidelización. de esta manera, el profesional en comunicaciones sociales tiene la formación para detectar a tiempo cualquier indicio que pueda ser removido o aplicado que evite situaciones adversas que puedan influir en la interactividad de los empleados de la pyme con los clientes.', 'la comunicación como una herramienta estratégica para afianzar la relación entre empresa y cliente : estudio de caso: empresa distribuidora salta. la empresa distribuidora salta surgió hace   años como una empresa familiar, la misma se dedica a la comercialización mayorista de herramientas de construcción y de seguridad industrial. actualmente su mercado de comercialización es la provincia de salta y jujuy. la empresa hasta la fecha se cree que no consideró incorporar un sector de comunicación para optimizar la comunicación externa y así afianzar el vínculo con sus clientes la empresa desconoce la importancia de transmitir su visión, misión y objetivo para lograr el fortalecimiento de la relación con sus clientes. su comunicación externa se limita a la transmisión de precios y productos hoy en día la comunicación se ha convertido en una herramienta estratégica para toda empresa que quiera estar bien posicionada en el mercado. esto no quiere decir que la comunicación sea la clave del éxito, pero sí que forma parte del él, y de hecho a través de ella vamos a acercar al cliente la imagen que se quiera transmitir. una comunicación corporativa efectiva beneficia a la empresa para enmarcarse en un mercado cada vez más competitivo. las estrategias de comunicación son tan importantes que ayudan a una empresa a pensar sistemáticamente en el futuro, la obliga a ratificar o rectificar sus objetivos y políticas. conduce a una mejor coordinación de los esfuerzos de la compañía y proporciona estándares de desempeño claro para su control. por estos motivos, el proceso de investigación y posterior planificación, se dirigirá a observar y analizar como elabora la empresa sus estrategias de comunicación para transmitir sus mensajes a sus clientes. también se investigará qué es lo que comunica, como lo transmite y como ese mensaje, es interpretado por el cliente. esto es muy importante, ya que si sabemos cómo interpreta el cliente dichos mensajes, se podrá corroborar si la visión de la misma y las estrategias de comunicación están bien implementadas...']";"Licenciatura en Comunicaciones Sociales"
"0";"38";"0_comunicación_salta_investigación_interna";"['comunicación', 'salta', 'investigación', 'interna', 'comunicación interna', 'trabajo', 'imagen', 'estrategias', 'año', 'institucional']";"['la comunicación digital impulsada por el gobierno municipal en la ciudad de salta : gestión de los problemas de los ciudadanos en los servicios públicos a través de aplicaciones digitales. el presente trabajo se propone investigar cómo es gestionada la comunicación digital impulsada por el gobierno municipal de la ciudad de salta a través de la aplicación móvil salta activa para la gestión de trámites y la resolución de problemas a los que se enfrentan sus ciudadanos en cuanto a servicios públicos. en el mundo los gobiernos utilizan las aplicaciones móviles para mejorar la experiencia de los vecinos en sus ciudades, enfrentándose al reto de adecuar su organización a los nuevos paradigmas que surgen de la aplicación de las tecnologías de la información y comunicación tics a las distintas áreas. en el caso de salta capital, la aplicación salta activa fue presentada como un acercamiento al concepto de gobierno móvil que supone integrar el uso de las tics en la evolución de la ciudad, proyectando mejoras notables en la provisión de servicios y resolución de conflictos de los ciudadanos. para que el sistema planteado por la secretaría de modernización de la ciudad de salta a través de la aplicación móvil salta activa, evolucione de un modelo de gestión tradicional a un modelo de gobierno móvil es necesario: en primer lugar que el líder municipal promueva el uso de la tecnología en los distintos sectores de la administración, en segundo lugar, contar con profesionales capacitados y finalmente que los funcionarios de la administración pública incluyan al usuario ciudadano en todo el sistema, y presten especial atención a las formas de comunicarse, interactuar y medir su satisfacción. esta investigación se complementa con un trabajo de campo de carácter cualitativo, en el que se encuesta a más de   ciudadanos, a empleados municipales y tres entrevistas: a martín güemes, secretario de modernización de la municipalidad de salta; a marcos malamud, dueño y creador de mismática, empresa que se dedica a realizar aplicaciones de gestión; y a alejandro lombardi, director general de multimedia de la municipalidad de salta. se concluyó que la forma de gestionar la comunicación no corresponde al esquema comunicacional de las tics, pues la información no llega a penetrar en el ámbito social debido al manejo deficiente de la multidireccionalidad, característica del esquema de comunicación digital. no hay una interactividad en el proceso y una de las partes los vecinos no obtiene respuesta.', 'la comunicación interinstitucional : una necesidad para el buen desarrollo institucional. estudio de caso: salta solidaria en red. se presenta la presente tesis de grado en la facultad de artes y ciencias de la ucasal, como cumplimiento de la carrera universitaria para obtener el título de grado de licenciada en comunicaciones sociales. el objetivo de la investigación en cuestión, fue analizar las estrategias de comunicación interinstitucional empleadas por salta solidaria en red , en relación a su desempeño institucional. salta solidaria en red , es una organización que nuclea a organizaciones sociales de salta. tiene como objetivo representar a las organizaciones sociales, orientarlas hacia un perfeccionamiento y consolidación en cuanto a: el desarrollo de proyectos de incidencia en políticas públicas; alcanzar los objetivos comunes; propiciar el fortalecimiento, aumentado la calidad y eficiencia de los procesos de desarrollo institucional y social comunitario. para llevar a cabo la investigación se planteó una metodología funcionalista apoyada en el enfoque interpretativo de la comunicación, en base a un diseño cualitativo, cuantitativo y descriptivo. las técnicas de recolección de datos fueron, fuentes documentales, encuestas aplicadas a una muestra de   organizaciones pertenecientes a salta solidaria en red, seleccionas a través de un muestreo no probabilístico intencional. por otro lado, se realizaron encuestas dirigidas hacia un público externo, para conocer otro enfoque de los resultados de las estrategias de comunicación empleadas. también se llevaron a cabo grupos focales, y análisis de contenido. para el análisis de la información obtenida, se recurrió a un abordaje a partir del cual se procedió a la categorización, codificación e interpretación de los resultados conforme al marco teórico y conceptual definido. de este modo se advirtió que salta solidaria en red es una institución reciente, que todavía se encuentra en proceso de constitución y crecimiento. cabe destacar que si bien no contempla un plan de comunicación interinstitucional concreto, y presenta algunas debilidades en cuanto a su comunicación externa, se observó que las estrategias empleadas hasta el momento, han beneficiado y potenciado el desarrollo institucional. a su vez, se identificaron ciertos aspectos propios de su naturaleza de origen que se reconocen como fortalezas para el perfeccionamiento de las estrategias de comunicación interinstitucional para lograr la concreción de objetivos de cohesión, sentido de pertenencia y metas institucionales concretas.', 'caracterización de la gestión de comunicación interna en el nivel secundario del colegio milagroso niño jesús de praga y su impacto en el público interno en marzo de  . en la actualidad, cuando la comunicación interna es eficiente en una organización, institución o empresa es un factor que produce una mejora en la productividad y el desarrollo de un buen clima laboral. esto, desemboca en darle mayor prestigio o notoriedad a dicha empresa. en   joan costa ya hablaba de la importancia de hacer que el empleado se enamore de la institución donde trabaja. también, mencionaba que en latinoamérica existía un gran interés por esta propuesta. ahora bien, realmente existía ese afán? qué hace que una comunicación interna sea eficiente o ineficiente? se puede trasladar un modelo de comunicación interna que funciona bien en una institución a otras? estas preguntas pueden ser abordadas desde distintas perspectivas y teorías, pero, llevan a otro cuestionamiento: qué características posee una gestión de comunicación interna en una institución latinoamericana en   si en   ya había interés por que sea eficiente? si bien, en ciencias sociales no se puede universalizar un resultado, esta pregunta es la que da pie al objetivo central de esta tesis. el objetivo de esta investigación es identificar las características de la gestión de comunicación interna que presenta el colegio milagroso niño jesús de praga n   y analizar el impacto en los distintos públicos internos del nivel secundario en marzo de  . para ello, se seleccionaron conceptos claves como imagen institucional, gestión de comunicación, comunicación institucional, comunicación interna y comunicación interna eficiente e ineficiente. esta es una investigación que se sitúa dentro del enfoque de estudio cualitativo, que tiene como punto de partida que la realidad debe descubrirse, construirse e interpretarse. a su vez, se ubica dentro del paradigma constructivista que tiene la necesidad de comprender el sentido de la acción social en el contexto del mundo de la vida y desde la perspectiva de los participantes. además, el diseño de investigación es de tipo de no experimental, transeccional y descriptivo. con el fin de describir las características de un fenómeno utilizando criterios sistemáticos para destacar los elementos esenciales de su naturaleza en un recorte del tiempo. en este caso, para describir las características de la gestión de comunicación interna del nivel secundario del colegio milagroso niño jesús de praga y analizar el impacto en los distintos públicos internos en marzo de  . también, se hace uso del muestreo no probabilístico. y como técnicas de recolección de datos, se eligió: la entrevista, la encuesta por cuestionario y la de documentos, registros, materiales y artefactos. las primeras dos se aplican a una muestra de empleados docentes y no docentes y alumnos del nivel secundario del colegio. y la última técnica se aplica a elementos tangibles y visibles que intervienen en el proceso de gestión de comunicación, para que, al momento de aplicar la triangulación de métodos de recolección de datos, la información sea más enriquecedora.']";"Licenciatura en Comunicaciones Sociales"
"1";"32";"1_redes_sociales_redes sociales_comunicación";"['redes', 'sociales', 'redes sociales', 'comunicación', 'salta', 'medios', 'trabajo', 'investigación', 'marca', 'análisis']";"['la participación ciudadana en los medios de comunicación de salta y sus plataformas virtuales. la presente investigación consiste en un estudio de casos realizado a ocho medios masivos de comunicación de la ciudad de salta capital, pertenecientes al rubro de radio, televisión, prensa escrita y portal digital. mediante este trabajo se buscó conocer cómo se desarrolla el periodismo ciudadano en estos medios locales, y determinar si utilizan herramientas o programas online para medir la participación ciudadana en la web. se abordaron teorías vinculadas a la comunicación y a la evolución del periodismo en el tiempo hasta llegar al denominado periodismo ciudadano, participativo, o  . en cuanto a la metodología, se aborda la investigación desde una lógica deductiva de análisis de datos cualitativos y cuantitativos recolectados a través de cuestionarios abiertos dirigidos a periodistas y profesionales de los medios de comunicación. también se utilizó una grilla de análisis documental que registró la participación ciudadana en cada uno de los medios de comunicación. para esto se analizan sus plataformas digitales y redes sociales. respecto a los resultados, se logró conocer cómo funcionan los medios comunicación de salta; qué cambios internos tuvieron en estos últimos años; de qué manera interactúa el público; cuáles son las noticias que seleccionan y consumen preferentemente; por qué algunos medios tienen mayor feedback que otros; qué datos proporciona la analítica web; y por qué es importante analizar la audiencia en las plataformas online.', 'la comunicación institucional a través de las redes sociales : el caso de la policía de la provincia de salta. la comunicación institucional ha tenido que adecuarse a los paradigmas que han impuesto las nuevas formas de comunicación, influenciadas por el avance de las redes sociales. en ese sentido, el trabajo de tesis apunta a determinar cuál es el uso actual que hace la policía de la provincia de salta respecto de las redes sociales, que son las que constituyen parte de su identidad e imagen institucional. haciendo uso del análisis de contenido, la presente tesis de grado propone evaluar cuál es el estado de las redes sociales facebook e instagram de la policía de la provincia de salta, y a su vez, dar cuenta de cómo funciona el departamento de prensa de la misma institución. por último, y como parte de un aporte académico, propone la creación de una guía de trabajo para redes sociales, teniendo en cuenta el análisis y evaluación de la gestión actual, en pos de un trabajo que comunique y refleje una identidad institucional tal como se estipula en la misión, los objetivos y valores de la policía de la provincia de salta.', 'comunicación pública del gobierno municipal de la ciudad de salta : el plan de medios con foco en redes sociales durante el período  . el propósito de este trabajo es investigar y describir de qué manera se gestionó el plan de medios para la comunicación pública del gobierno municipal de la ciudad de salta en la red social instagram durante el período de aislamiento social, preventivo y obligatorio en  . a partir del período de confinamiento producto del covid   han cambiado los paradigmas de la comunicación de los gobiernos en el mundo. las redes sociales se han convertido en el medio fundamental para que las instituciones públicas permanezcan cerca de los ciudadanos y puedan, a su vez, visibilizar su gestión. la disciplina de la planificación de medios constituye una herramienta imprescindible para lograr una comunicación eficaz por parte de los gobiernos hacia los ciudadanos. la municipalidad de la ciudad de salta, encabezada por la intendencia de la dra. bettina romero, ha puesto sus esfuerzos en potenciar su cuenta oficial de instagram como estrategia para mantener la proximidad con los ciudadanos y mostrar que el gobierno local continuó trabajando durante el período de aislamiento. el trabajo de campo incluye el análisis de contenido de publicaciones seleccionadas de la cuenta oficial de la municipalidad de salta con el objetivo de analizar las características de las mismas durante el período  , describir el uso que se le ha dado a la red social y sus herramientas y determinar si se han empleado herramientas de planificación de medios para desplegar el plan de comunicación pública. también se cuenta con entrevistas al personal de la secretaría de prensa y comunicación de la municipalidad y con una encuesta realizada a ciudadanos de la capital de salta. los resultados indican que el gobierno local no recurrió a la disciplina de la planificación de medios como tal para aplicar una estrategia de comunicación en instagram, sino que utilizó algunas de sus herramientas de manera aislada para intentar adaptarse al nuevo paradigma comunicacional producto del confinamiento.']";"Licenciatura en Comunicaciones Sociales"
"2";"10";"2_banda_danza_análisis_público";"['banda', 'danza', 'análisis', 'público', 'canciones', 'investigación', 'audiovisual', 'comunicación', 'trabajo', 'artistas']";"['la construcción lingüistica en las letras de la música de los raperos salteños y la recepción de su público cercano. la investigación que se realiza tiene como problemática identificar los recursos lingüísticos que utilizan los raperos salteños sandoval, ezequiel, barrionuevo, yamila y escandell britos, javier a la hora de componer sus canciones. además, se busca conocer el modo de recepción por parte del público cercano de estos artistas y cuáles son los roles de los mismos al escuchar estas canciones. en cuanto al objetivo general se busca analizar los recursos lingüísticos en las composiciones musicales de raperos salteños y el rol del público cercano como destinatario. de acuerdo a los objetivos específicos, en primer lugar, se descomponen y examinan sus canciones a través de un análisis de los recursos retóricos. con respecto al segundo término, se identifican los recursos lingüísticos implementados en las composiciones de raperos salteños. el tercer objetivo será determinar los modos de recepción por parte del público de estos artistas, que consumen su arte y, por último, describir el rol del público cercano como destinatario. la construcción de este trabajo, se lleva a cabo a partir de una investigación de tipo cualitativa. mediante las categorizaciones y elementos de análisis e investigación explicados anteriormente, se realiza un desglosamiento de los discursos musicales para lograr determinar los recursos teóricos a encontrar. por otro lado, se busca conocer en detalle los modelos de recepción y sus roles a través de la entrevista como forma de complementación para la información a hallar para la aprobación de los supuestos de conocimiento.', 'comunicación alternativa: los murales de walpaq y julien guinet en la ciudad de salta : año  . la presente investigación se enmarca en el ámbito de la comunicación alternativa y se centra en el fenómeno particular del muralismo en la ciudad de salta capital. se seleccionó a los artistas jesús walpaq y julien guinet, con el objetivo de indagar en la simetría que existe entre el mensaje ideado por ellos y la lectura del público adulto que observa sus principales murales. en el marco teórico se tomó al muralismo como medio de comunicación alternativa y popular, fundamentado en que cualquier ser humano puede tomar los mensajes que se plasman en las paredes e interpretarlos, de modo tal que pueda o no coincidir con la mirada e intención de los creadores. también se muestra un recorrido histórico de los principales artistas y ciudades donde el muralismo tuvo su auge. cada mural forma parte de un contexto económico, social, político y hasta sentimental que envuelve a gran parte de los ciudadanos, por el solo hecho de pertenecer y participar de vivencias terrenales correspondientes a un tiempo, momento y lugar específicos en los que el artista decide dejar un mensaje read,   . en cuanto al aspecto metodológico, se aplicaron   encuestas personales a transeúntes, se registraron fotográficamente las obras, se realizaron   análisis semióticos de las imágenes de los murales y dos entrevistas personales a los artistas. a partir de la recolección y análisis de los datos quedó en evidencia que el   n   de los encuestados afirmó entender el muralismo como arte, el   n   lo vinculaba con la comunicación, mientras que una minoría, el   n   , lo veía como un acto de vandalismo. el   n   no supo qué contestar. según el   n   de las personas encuestadas los murales analizados estaban comunicando algo, mientras que solo el   n   no encontraba mensaje alguno en ellos sino que lo consideraban una pieza de arte. más de la mitad de los murales analizados, siete de los trece, mantiene una simetría con los significados explicados por los muralistas en las entrevistas.', 'identificación, caracterización y difusión del movimiento ricotero en salta. el trabajo de tesis de grado describe el movimiento ricotero en la ciudad de salta, analizando el impacto que tiene la figura del indio solari en sus seguidores. el mismo surge de la curiosidad de la investigadora en querer entender por qué tanta gente forma parte de ese movimiento y cómo es que se mantiene hace tantos años incluso sumando cada vez más adeptos. para esto se comenzó con una investigación sobre la banda patricio rey y sus redonditos de ricota, de la cual solari supo ser el cantante principal antes de su etapa solista. esta permitió conocer los orígenes musicales, el contexto y las influencias que tuvo para forjar su carrera. una vez que se pudo conocer la carrera del músico y todo el fenómeno que se había formado en torno a la banda se procedió a analizar el mensaje que tienen sus canciones para conocer a qué hacen referencia. allí se optó por estudiar la letra de ji ji ji , por considerarla como uno de los grandes hitos de la carrera musical de solari. el próximo paso fue detallar y describir el primer recital del indio en salta, donde se pudo apreciar en primera persona los sentimientos y sensaciones que manifiestan los ricoteros para con el cantante, a través de sus testimonios. también se entabló un dialogo a través de entrevistas con un grupo de fanáticos quienes dieron su opinión respecto al fenómeno y al músico, como así también compartieron historias increíbles de experiencias en los recitales. además de contar con la palabra de un especialista en el fenómeno ricotero, quien vivió el auge de los redondos y la transición del indio a su etapa solista. muchos hablan de mística al nombrar a solari o al tratar de explicar ese sentimiento que los mueve a seguirlo como artista. en su gran mayoría los seguidores logran hacer una separación del indio músico por sobre el indio persona, llegando incluso a no darle ningún tipo de relevancia a su vida privada ni sus pensamientos. su arte, su música, sus letras parecen ser lo que hace, literalmente, mover multitudes por todo el país.']";"Licenciatura en Comunicaciones Sociales"
