"topic";"count";"name";"representation";"representative_docs";"carrera"
"0";"60";"0_investigación_salta_nivel_año";"['investigación', 'salta', 'nivel', 'año', 'jóvenes', 'docentes', 'emocional', 'ciudad', 'factores', 'estudiantes']";"['la función del chiste para los profesionales enfermeros que se desempeñan en la uti del hospital papa francisco. esta investigación abordó los juegos psicológicos llevados a cabo en facebook, enmarcándose dentro del análisis transaccional. con el objetivo de describir la dinámica interna de los mismos, se indagaron los roles desde el triángulo dramático de karpman, las transacciones ulteriores y el grado de relación entre las personas que formaban parte de los mismos. el enfoque de la investigación fue cualitativo, de alcance descriptivo con un diseño fenomenológico. la muestra estuvo conformada por nueve participantes, a los cuales se les realizó una entrevista semi estructurada y se construyó en base al perfil de facebook de los mismos el registro individual. los resultados demostraron que se desarrollaban juegos psicológicos en facebook, iniciando a partir de publicaciones realizadas dentro del perfil, conteniendo la transacción ulterior. respecto al mensaje social o consciente, hacía referencia al humor, la risa, el chiste, identificación con el contenido y al ser interesante. por otro lado, el mensaje no consciente aludía a: soy tonto, no hago nada bien, los demás son inferiores, reconózcanme, soy superior, están en deuda conmigo y nací para sufrir. en cuanto a los roles, estos cambiaban de publicación en publicación, reconociéndose a lo largo de los perfiles tanto el de salvador, perseguidor y víctima. por otro lado, el grado de relación con quienes participaban de los juegos variaba entre estrecha, distante y con desconocidos.', 'inteligencia emocional en docentes de educación especial de la ciudad de salta. la presente investigación es un estudio cuantitativo, no experimental, de diseño exploratorio y correlacional, que trata el tema de la inteligencia emocional en docentes de educación especial de la ciudad de salta durante el año  . el fin propuesto es conocer la relación de los niveles de inteligencia emocional, por medio de las tres dimensiones que la componen, y los años de docencia . se trabajó con una muestra de   docentes, conformada por   mujeres y   varones, todos docentes de grado en educación especial que desempeñan su actividad en alguna de las cuatro escuelas de gestión pública de educación especial de la ciudad de salta. se aplicó el cuestionario de tipo auto administrado tmms  , al cual se le agregó una pregunta para conocer la antigüedad laboral de los docentes. para un mejor análisis, la población fue dividida en cinco categorías de cinco años cada una. los resultados obtenidos por la prueba permitieron concluir que no existe una relación directa entre la inteligencia emocional y los años de docencia en los docentes del nivel primario de las escuelas de gestión pública de educación especial en la ciudad de salta capital durante el año  . por lo tanto se corrobora una de las hipótesis de estudio, afirmando que entre estas dos variables existe una correlación nula. en términos generales, los docentes de educación especial presentan bajos niveles de atención emocional y niveles adecuados en las dimensiones claridad y reparación emocional. se observó que en las cinco categorías estudiadas no existe el predominio de alguna de las dimensiones de la inteligencia emocional, sin embargo, los niveles de claridad y reparación emocional mantienen puntajes adecuados en casi los   años del labor docente.', 'desarrollo de habilidades sociales en alumnos con discapacidad intelectual, que cursan el programa de educación ambiental de cascos verdes, en la ucasal, en el año  . esta investigación abordó los juegos psicológicos llevados a cabo en facebook, enmarcándose dentro del análisis transaccional. con el objetivo de describir la dinámica interna de los mismos, se indagaron los roles desde el triángulo dramático de karpman, las transacciones ulteriores y el grado de relación entre las personas que formaban parte de los mismos. el enfoque de la investigación fue cualitativo, de alcance descriptivo con un diseño fenomenológico. la muestra estuvo conformada por nueve participantes, a los cuales se les realizó una entrevista semi estructurada y se construyó en base al perfil de facebook de los mismos el registro individual. los resultados demostraron que se desarrollaban juegos psicológicos en facebook, iniciando a partir de publicaciones realizadas dentro del perfil, conteniendo la transacción ulterior. respecto al mensaje social o consciente, hacía referencia al humor, la risa, el chiste, identificación con el contenido y al ser interesante. por otro lado, el mensaje no consciente aludía a: soy tonto, no hago nada bien, los demás son inferiores, reconózcanme, soy superior, están en deuda conmigo y nací para sufrir. en cuanto a los roles, estos cambiaban de publicación en publicación, reconociéndose a lo largo de los perfiles tanto el de salvador, perseguidor y víctima. por otro lado, el grado de relación con quienes participaban de los juegos variaba entre estrecha, distante y con desconocidos.']";"Licenciatura en Psicología"
"1";"48";"1_salud_investigación_hospital_salud mental";"['salud', 'investigación', 'hospital', 'salud mental', 'mental', 'salta', 'tratamiento', 'trabajo', 'doctor', 'psicoanálisis']";"['el rol del psicólogo en el desarrollo de las habilidades psicosociales de los usuarios de la sala de varones del hospital de salud mental doctor miguel ragone, en la provincia de salta en el año  . el presente trabajo final de grado es un informe de pasantía académica de la carrera de licenciatura en psicología, de la ucasal, que tuvo lugar en el hospital de salud mental doctor miguel ragone, durante el año  . se sustenta teóricamente en el enfoque psicosocial y de salud pública con bases en la ley de salud mental nº     y la ley de la convención sobre los derechos de las personas con discapacidad nº     . el objetivo general fue conocer el rol del psicólogo en el desarrollo de las habilidades psicosociales de los usuarios de la sala de varones de la institución. la población con la que se trabajó estuvo compuesta por los   usuarios adultos de la sala de varones, que presentaban diferentes padecimientos mentales, entre ellos algunos con discapacidad y por el equipo interdisciplinario formado por psicólogos, psiquiatras, trabajadoras sociales, personal de enfermería, médicos clínicos, odontólogos, docentes y talleristas. se llevaron a cabo entrevistas cualitativas y semiestructuradas a los usuarios y profesionales de la sala de varones, como así también se usaron notas de campo para registrar información pertinente durante la observación participativa en las diferentes actividades propuestas. se considera que la información obtenida permitió alcanzar los objetivos de conocer qué tipo de habilidades son las que se trabajan y desarrollan en la institución, tales como las habilidades cognitivas y sociales. respecto al trabajo del equipo interdisciplinario, los profesionales se orientan al reforzamiento y promoción de los lazos sociales, al crecimiento personal y a la reinserción social. con ello se busca el desarrollo de las habilidades psicosociales que apunten a un estilo de vida saludable; acorde a las posibilidades y capacidades de los usuarios.', 'el rol del psicólogo en el proceso terapéutico de externación de usuarios de la sala de varones del hospital de salud mental doctor miguel ragone en el año  . el presente trabajo es el resultado de la realización de la pasantía académica como trabajo final de grado de la carrera de licenciatura en psicología, que se llevó a cabo en el hospital de salud mental doctor miguel ragone, en el periodo comprendido entre el   de agosto y el   de diciembre del año  . esta pasantía tuvo como objetivo general adquirir competencias teórico prácticas con base en el rol del psicólogo en los procesos terapéuticos de externación de los usuarios de la sala de varones en dicha institución. además, contó con tres objetivos específicos: describir el rol del psicólogo y sus funciones en los procesos terapéuticos de externación; conocer las actividades de inclusión productivas laborales que ofrece el hospital a los usuarios de la sala de varones; y adquirir conocimientos y experiencias sobre el acompañamiento de referentes afectivos en los procesos terapéuticos de externación en el hospital de salud mental doctor miguel ragone. se considera que los objetivos fueron cumplidos exitosamente en tiempo y forma, con   trescientas horas de trabajo no rentado y con la ejecución de diversas actividades y tareas dentro de la institución. esta práctica hizo posible el desarrollo de conocimientos y experiencias referidos a la labor y desempeño del psicólogo en una institución de salud mental atravesados por la perspectiva en psicología comunitaria.', 'representaciones sociales de los profesionales de salud mental sobre las modalidades de atención psicoterapéuticas implementadas durante el aislamiento social, preventivo y obligatorio, y su incidencia en la práctica actual. la pandemia por covid   ha tenido un profundo impacto en la prestación de servicios de salud mental en todo el mundo. en este contexto de desafíos sin precedentes, los profesionales de la salud mental se vieron obligados a adaptarse rápidamente para garantizar la continuidad de la atención psicoterapéutica. en esta investigación se exploraron las representaciones sociales de los profesionales de salud mental de los hospitales de iv nivel de complejidad de la ciudad de salta acerca de la modalidad de atención psicoterapéutica implementada durante el aislamiento social, preventivo y obligatorio de la emergencia sanitaria covid   y su incidencia en la práctica actual. para ello se abordaron los aspectos cognitivo, figurativo y valorativo de las modalidades de atención psicoterapéutica implementadas durante el periodo del aislamiento social, preventivo y obligatorio. identificando las modificaciones en la atención psicoterapéutica, y cómo éstas influyeron e influyen en la práctica actual. se utilizó una metodología de tipo cualitativa, de nivel descriptivo, y un diseño fenomenológico para la construcción y análisis de datos. se realizaron   entrevistas semiestructuradas a profesionales de los servicios de salud mental, tanto psicólogos como psiquiatras, de las siguientes instituciones: hospital san bernardo, hospital doctor arturo oñativia, hospital señor del milagro, hospital público materno infantil y hospital de salud mental doctor miguel ragone. entre los hallazgos más significativos se encontró que existieron representaciones sociales tanto de la modalidad de atención presencial como de la modalidad virtual. el trabajo de investigación también revela la transformación duradera en la forma en que se brinda atención a los pacientes, con la continuidad de la atención virtual después de levantadas las restricciones de la pandemia. esta investigación arroja luz sobre cómo los profesionales de salud mental se adaptaron a la pandemia de covid  , introduciendo cambios significativos en sus prácticas y modalidades de atención psicoterapéutica. la modalidad de atención virtual se ha convertido en una herramienta esencial y sostenible en salud mental en salta, argentina, marcando una nueva etapa en la prestación de la salud mental en tiempos de crisis, e instaurándose como una práctica que llegó para quedarse.']";"Licenciatura en Psicología"
"2";"26";"2_mujeres_violencia_investigación_género";"['mujeres', 'violencia', 'investigación', 'género', 'salta', 'participantes', 'violencia género', 'pareja', 'presente', 'amor']";"['prisión domiciliaria en mujeres : violencias y vulnerabilidad. el presente trabajo de investigación abordará acerca de las violencias y vulnerabilidades que anteceden al contexto carcelario, vivenciadas por mujeres con prisión domiciliaria que tienen niñas, niños y adolescentes a su cargo, residentes en la ciudad de salta capital y que dependen de la dirección de inserción social y supervisión de liberados de la provincia de salta en el periodo  . así mismo se pretende establecer una posible vinculación entre las violencias y las vulnerabilidades en las trayectorias de vida de las mujeres y las conductas delictivas por las cuales se encuentran privadas de libertad. a nivel metodológico esta investigación tiene un enfoque cualitativo de tipo descriptivo y un diseño de investigación narrativo. la investigación tuvo lugar en la ciudad de salta capital y la unidad de análisis son las mujeres usuarias de la dirección de inserción social y supervisión de liberados, que se encuentran con prisión domiciliaria, esta estuvo constituida por tres participantes determinadas por la directora de la dirección. los instrumentos utilizados para la recolección de información fueron el análisis de archivos, la observación participante y entrevistas profundas de tipo semiestructurada. esta investigación le proporcionó un espacio de escucha, para que las participantes en primera persona pudieran expresarse y de esta forma aportar al conocimiento de las diferentes realidades de las mujeres con prisión domiciliaria. entre los hallazgos de la investigación, se destaca que las trayectorias de vida de las mujeres estuvieron marcadas por múltiples violencias y vulnerabilidades desde la niñes presente en los vínculos con la familia de origen, carencias socio económicas y la violencia de genero dentro de las relaciones afectivas de pareja. se espera que los resultados de estes estudio tenga fines prácticos y constituyan una fuente de información para el ministerios de seguridad y justicia, en la dirección de inserción social y supervisión de presos y liberados, poder judicial, ministerio público y toda la administración de justicia para el abordaje integral con perspectiva de género en el trabajo con el colectivo de mujeres con prisión domiciliaria. además, se espera que los resultados promuevan el interés de comunidades educativas respecto a la problemática de la violencia de genero.', 'creencias irracionales y violencia de género : una mirada desde la terapia racional emotiva conductual sobre las mujeres víctimas de violencia de género en la pareja. la presente investigación surge con la finalidad de conocer las creencias irracionales de las mujeres de entre   y   años de edad víctimas de violencia de género en la pareja. se trata de una investigación cualitativa de nivel descriptivo, con un diseño de tipo fenomenológico. las participantes fueron doce mujeres víctimas de violencia de género en la pareja que asisten al área del servicio de asistencia de la dirección general área de la mujer del programa de protección a la víctima de violencia familiar , de la municipalidad de la ciudad de salta, durante el año  . se empleo como instrumento de investigación la entrevista individual semi dirigida y la observación fenomenológica. entre los resultados, se identificaron en las participantes las creencias irracionales formuladas por albert ellis, que interfieren en la consecución de sus metas y propósitos.', 'las representaciones sociales del personal de la policía de la provincia de salta sobre las mujeres que denuncian violencia de género en el año  . la presente investigación se enmarcó dentro del campo de la psicología social donde se propuso el estudio de las representaciones sociales del personal de la policía de la provincia de salta sobre las mujeres que denunciaron violencia de género en el periodo  . el enfoque utilizado fue cualitativo de tipo descriptivo donde se utilizó el diseño fenomenológico. las unidades de análisis fueron en total ocho participantes cuatro femeninos y cuatro masculinos de cargos oficiales y suboficiales de la policía de la provincia de salta. el instrumento de recolección de datos fueron las entrevistas semiestructuradas desde las cuales se realizó la construcción de categorías para el análisis. el marco teórico central de la investigación fue la teoría de las representaciones sociales y los aportes actuales desde una perspectiva de género. la pregunta eje de investigación fue cuáles son las representaciones sociales del personal de la policía de la provincia de salta sobre las mujeres que denunciaron violencia de género durante el período  ? a fines de responder esta pregunta de investigación se propuso como objetivo central el describir las representaciones sociales del personal de la policía de la provincia de salta sobre las mujeres que denunciaron violencia de género durante el período  . entre los hallazgos principales se reconoció que las y los policías poseen representaciones sociales sobre las mujeres que denuncian violencia de género aportando dos variables, la primera que las mujeres que denunciaron están atravesadas por problemáticas económicas y educacionales y, la segunda, que dichas mujeres son victimarias. los resultados obtenidos en este estudio servirán para futuras intervenciones e investigaciones, para la psicología en particular y las ciencias sociales en general. a su vez, aportará datos para mejorar la toma de denuncia en el personal policial de la provincia de salta ante las violencias de género y contribuirá a la erradicación de las violencias contra las mujeres.']";"Licenciatura en Psicología"
"3";"16";"3_madres_hijo_madre_padres";"['madres', 'hijo', 'madre', 'padres', 'hijos', 'investigación', 'tipo', 'niños', 'down', 'síndrome down']";"['prácticas de crianza de los padres frente al berrinche de sus hijos de acuerdo con el tipo de representación mental de apego que poseen. la presente investigación tuvo como objetivo conocer las prácticas de crianza de los padres frente al berrinche de sus hijos de acuerdo con el tipo de representación mental de apego que poseen. se trató de una investigación cualitativa de nivel descriptivo, con un diseño de tipo fenomenológico. en este estudio se trabajó con diez padres y madres entre los   y los   años de edad, cuyos hijos as asistían al jardín materno infantil de la universidad nacional de salta durante el año  , quienes de manera voluntaria y por su disponibilidad, aceptaron participar. para la recolección de la información se emplearon dos instrumentos; por un lado, una entrevista semi dirigida para indagar las prácticas de crianza frente al berrinche, y por otro lado, se aplicó una entrevista comúnmente empleada para evaluar la representación mental de apego en adultos. para su análisis, se procedió a la categorización, codificación e interpretación de la información obtenida, a través de un proceso de triangulación, que posibilitó la discusión de los resultados a la luz del marco teórico y conceptual. los resultados de la investigación evidenciaron que los padres ponen en juego una amplia variedad de prácticas de crianza frente a situaciones de berrinche de sus hijos, y asimismo, se pudieron advertir algunas prácticas en común entre aquellos que se identificaron en un tipo particular de representación mental del apego. del mismo modo, surgieron diferencias entre los padres que presentaron un mismo tipo de representación mental de apego, manifestando otras prácticas en las que no se encontraron coincidencias, cuya presencia podría interpretarse a partir de otros factores, tales como la experiencia de los participantes de otros vínculos significativos a lo largo de su vida con familiares, docentes, terapeutas y la información de la que se dispone con respecto a la crianza.', 'el efecto traumático y el proceso de duelo en la vivencia de las madres por la desaparición de un hijo a, por presunción de secuestro y robo. el propósito de la investigadora fue identificar el efecto traumático y describir los indicadores emocionales y conductuales del proceso de duelo en la vivencia de las madres por la desaparición de un hijo a, por presunción de secuestro y robo. en la primera parte de este trabajo se comenzó realizando una revisión teórica de autores que fueron de gran aporte tales como víctor frankl, creador y precursor de la logoterapia. el marco teórico de esta investigación consta de los siguientes capítulos: capítulo  : logoterapia y trauma. efectos traumáticos. acontecimientos traumáticos. sentido de vida, triada trágica positiva, sufrimiento, triada trágica negativa. trauma y sentido existencial. capítulo  : proceso de duelo. etapas del proceso de duelo. tipos de duelo. proceso de duelo y desaparición de un hijo a, por presunción de secuestro y robo. capítulo  : vínculo madre hijo. motivaciones para engendrar a un hijo. programa de vida. afectividad materna. capítulo  : desaparición por presunción de secuestro y robo. destino sociológico desde la logoterapia. destino irremediable: desaparición de un hijo por presunción de secuestro y robo. desaparición de personas en la actualidad en la provincia de salta. las participantes de la investigación fueron dos madres mujeres, quienes accedieron en forma voluntaria a ser entrevistadas. se utilizaron como instrumentos la observación, la entrevista semiestructurada y la nota de campo, para recolectar la información requerida. a partir del análisis e interpretación de la información se concluye que las madres ante la desaparición de un hijo, experimentan un trastorno de estrés postraumático como también presentan indicadores emocionales y conductuales propios de un proceso de duelo no elaborado, evidenciando un estancamiento en la etapa depresiva y el sufrimiento que linda entre la esperanza e ilusión. sostenidas en la creencia de que sus hijos están vivos, mientras sus cuerpos no aparezcan como vestigios de muerte.', 'la atención temprana en el desarrollo de niños con síndrome de down : dinámica vincular madre hijo. la presente investigación fue realizada durante el año   en la estrella centro de estimulación temprana y educación inicial para niños con síndrome de down azucena barbarán alvarado , de la ciudad de salta capital, con un grupo de madres de niños de entre   días y   años de edad, quienes recibían estimulación temprana. el objetivo general de la misma ha sido conocer la dinámica vincular entre madres e hijos que asisten al servicio de atención temprana de la estrella . los objetivos específicos apuntaron a identificar las relaciones entre el proceso de elaboración del duelo por la pérdida del ideal proyectado en un hijo por nacer, el sostén institucional y la dinámica vincular establecida entre madre e hijo. para ello se han realizado observaciones, entrevistas y se han aplicado dos test proyectivos: el test del dibujo de la familia de corman   y el test de la familia real kinética kaufman, burns, r.   ; propiciando con ello el enriquecimiento del estudio. los fundamentos teóricos han sido los aportes de la psicología clínica infantil y los postulados psicoanalíticos que permitieron captar en profundidad los aspectos concientes e inconcientes que se manifiestan en la dinámica vincular y los procesos de elaboración del duelo por el hijo ideal. el análisis de los datos ha permitido concluir que la dinámica vincular entre las madres y sus niños opera en gran medida en función del proceso de elaboración del duelo por el hijo ideal; que el sostén institucional favorece el desenvolvimiento de las funciones maternas, propiciando un adecuado vínculo madre hijo; que el sostén emocional familiar es relevante para el despliegue de las funciones maternas; y que la forma en la que las madres reciben el diagnóstico de sus hijos potencia el impacto ante la realidad de los mismos.']";"Licenciatura en Psicología"
